tcpdump -i eth0 src 165.227.42.177

19:16:51.996013 IP lamponubuntu2204-s-1vcpu-1gb-35gb-intel-tor1-01.ssh > 198.96.85.21.51536: Flags [P.], seq 40184:40668, ack 37, win 501, length 484
19:16:51.996071 IP lamponubuntu2204-s-1vcpu-1gb-35gb-intel-tor1-01.ssh > 198.96.85.21.51536: Flags [P.], seq 40668:41152, ack 37, win 501, length 484
19:16:51.996121 IP lamponubuntu2204-s-1vcpu-1gb-35gb-intel-tor1-01.ssh > 198.96.85.21.51536: Flags [P.], seq 41152:41492, ack 37, win 501, length 340
19:16:51.996170 IP lamponubuntu2204-s-1vcpu-1gb-35gb-intel-tor1-01.ssh > 198.96.85.21.51536: Flags [P.], seq 41492:41824, ack 37, win 501, length 332
19:16:51.996239 IP lamponubuntu2204-s-1vcpu-1gb-35gb-intel-tor1-01.ssh > 198.96.85.21.51536: Flags [P.], seq 41824:42308, ack 37, win 501, length 484
19:16:51.996315 IP lamponubuntu2204-s-1vcpu-1gb-35gb-intel-tor1-01.ssh > 198.96.85.21.51536: Flags [P.], seq 42308:42944, ack 37, win 501, length 636
19:16:51.996367 IP lamponubuntu2204-s-1vcpu-1gb-35gb-intel-tor1-01.ssh > 198.96.85.21.51536: Flags [P.], seq 42944:43284, ack 37, win 501, length 340
19:16:51.996420 IP lamponubuntu2204-s-1vcpu-1gb-35gb-intel-tor1-01.ssh > 198.96.85.21.51536: Flags [P.], seq 43284:43616, ack 37, win 501, length 332
19:16:51.996500 IP lamponubuntu2204-s-1vcpu-1gb-35gb-intel-tor1-01.ssh > 198.96.85.21.51536: Flags [P.], seq 43616:44100, ack 37, win 501, length 484
19:16:51.996548 IP lamponubuntu2204-s-1vcpu-1gb-35gb-intel-tor1-01.ssh > 198.96.85.21.51536: Flags [P.], seq 44100:44440, ack 37, win 501, length 340
19:16:51.996599 IP lamponubuntu2204-s-1vcpu-1gb-35gb-intel-tor1-01.ssh > 198.96.85.21.51536: Flags [P.], seq 44440:44780, ack 37, win 501, length 340
19:16:51.996660 IP lamponubuntu2204-s-1vcpu-1gb-35gb-intel-tor1-01.ssh > 198.96.85.21.51536: Flags [P.], seq 44780:45264, ack 37, win 501, length 484
19:16:51.996713 IP lamponubuntu2204-s-1vcpu-1gb-35gb-intel-tor1-01.ssh > 198.96.85.21.51536: Flags [P.], seq 45264:45604, ack 37, win 501, length 340
19:16:51.996765 IP lamponubuntu2204-s-1vcpu-1gb-35gb-intel-tor1-01.ssh > 198.96.85.21.51536: Flags [P.], seq 45604:45944, ack 37, win 501, length 340
19:16:51.996821 IP lamponubuntu2204-s-1vcpu-1gb-35gb-intel-tor1-01.ssh > 198.96.85.21.51536: Flags [P.], seq 45944:46428, ack 37, win 501, length 484
19:16:51.996870 IP lamponubuntu2204-s-1vcpu-1gb-35gb-intel-tor1-01.ssh > 198.96.85.21.51536: Flags [P.], seq 46428:46768, ack 37, win 501, length 340
19:16:51.996927 IP lamponubuntu2204-s-1vcpu-1gb-35gb-intel-tor1-01.ssh > 198.96.85.21.51536: Flags [P.], seq 46768:47252, ack 37, win 501, length 484
19:16:51.996975 IP lamponubuntu2204-s-1vcpu-1gb-35gb-intel-tor1-01.ssh > 198.96.85.21.51536: Flags [P.], seq 47252:47592, ack 37, win 501, length 340
19:16:51.997025 IP lamponubuntu2204-s-1vcpu-1gb-35gb-intel-tor1-01.ssh > 198.96.85.21.51536: Flags [P.], seq 47592:47932, ack 37, win 501, length 340
19:16:51.997078 IP lamponubuntu2204-s-1vcpu-1gb-35gb-intel-tor1-01.ssh > 198.96.85.21.51536: Flags [P.], seq 47932:48120, ack 37, win 501, length 188
19:16:51.997120 IP lamponubuntu2204-s-1vcpu-1gb-35gb-intel-tor1-01.ssh > 198.96.85.21.51536: Flags [P.], seq 48120:48308, ack 37, win 501, length 188
19:16:51.997176 IP lamponubuntu2204-s-1vcpu-1gb-35gb-intel-tor1-01.ssh > 198.96.85.21.51536: Flags [P.], seq 48308:48792, ack 37, win 501, length 484
19:16:51.997222 IP lamponubuntu2204-s-1vcpu-1gb-35gb-intel-tor1-01.ssh > 198.96.85.21.51536: Flags [P.], seq 48792:48964, ack 37, win 501, length 172
19:16:52.098686 IP lamponubuntu2204-s-1vcpu-1gb-35gb-intel-tor1-01.ssh > 198.96.85.21.51536: Flags [P.], seq 48964:49152, ack 37, win 501, length 188
19:16:52.098787 IP lamponubuntu2204-s-1vcpu-1gb-35gb-intel-tor1-01.ssh > 198.96.85.21.51536: Flags [P.], seq 49152:49644, ack 37, win 501, length 492
19:16:52.098860 IP lamponubuntu2204-s-1vcpu-1gb-35gb-intel-tor1-01.ssh > 198.96.85.21.51536: Flags [P.], seq 49644:50280, ack 37, win 501, length 636
19:16:52.098932 IP lamponubuntu2204-s-1vcpu-1gb-35gb-intel-tor1-01.ssh > 198.96.85.21.51536: Flags [P.], seq 50280:50772, ack 37, win 501, length 492
19:16:52.098992 IP lamponubuntu2204-s-1vcpu-1gb-35gb-intel-tor1-01.ssh > 198.96.85.21.51536: Flags [P.], seq 50772:51264, ack 37, win 501, length 492
19:16:52.099038 IP lamponubuntu2204-s-1vcpu-1gb-35gb-intel-tor1-01.ssh > 198.96.85.21.51536: Flags [P.], seq 51264:51604, ack 37, win 501, length 340
19:16:52.099090 IP lamponubuntu2204-s-1vcpu-1gb-35gb-intel-tor1-01.ssh > 198.96.85.21.51536: Flags [P.], seq 51604:52096, ack 37, win 501, length 492
19:16:52.099132 IP lamponubuntu2204-s-1vcpu-1gb-35gb-intel-tor1-01.ssh > 198.96.85.21.51536: Flags [P.], seq 52096:52436, ack 37, win 501, length 340
19:16:52.099209 IP lamponubuntu2204-s-1vcpu-1gb-35gb-intel-tor1-01.ssh > 198.96.85.21.51536: Flags [P.], seq 52436:52624, ack 37, win 501, length 188
19:16:52.099233 IP lamponubuntu2204-s-1vcpu-1gb-35gb-intel-tor1-01.ssh > 198.96.85.21.51536: Flags [P.], seq 52624:52660, ack 37, win 501, length 36
19:16:52.099274 IP lamponubuntu2204-s-1vcpu-1gb-35gb-intel-tor1-01.ssh > 198.96.85.21.51536: Flags [P.], seq 52660:53000, ack 37, win 501, length 340
19:16:52.099331 IP lamponubuntu2204-s-1vcpu-1gb-35gb-intel-tor1-01.ssh > 198.96.85.21.51536: Flags [P.], seq 53000:53492, ack 37, win 501, length 492
19:16:52.099394 IP lamponubuntu2204-s-1vcpu-1gb-35gb-intel-tor1-01.ssh > 198.96.85.21.51536: Flags [P.], seq 53492:53832, ack 37, win 501, length 340
19:16:52.099452 IP lamponubuntu2204-s-1vcpu-1gb-35gb-intel-tor1-01.ssh > 198.96.85.21.51536: Flags [P.], seq 53832:54324, ack 37, win 501, length 492
19:16:52.099506 IP lamponubuntu2204-s-1vcpu-1gb-35gb-intel-tor1-01.ssh > 198.96.85.21.51536: Flags [P.], seq 54324:54816, ack 37, win 501, length 492
19:16:52.099560 IP lamponubuntu2204-s-1vcpu-1gb-35gb-intel-tor1-01.ssh > 198.96.85.21.51536: Flags [P.], seq 54816:55308, ack 37, win 501, length 492
19:16:52.099641 IP lamponubuntu2204-s-1vcpu-1gb-35gb-intel-tor1-01.ssh > 198.96.85.21.51536: Flags [P.], seq 55308:55496, ack 37, win 501, length 188
19:16:52.099686 IP lamponubuntu2204-s-1vcpu-1gb-35gb-intel-tor1-01.ssh > 198.96.85.21.51536: Flags [P.], seq 55496:55836, ack 37, win 501, length 340
19:16:52.099752 IP lamponubuntu2204-s-1vcpu-1gb-35gb-intel-tor1-01.ssh > 198.96.85.21.51536: Flags [P.], seq 55836:56176, ack 37, win 501, length 340
19:16:52.202679 IP lamponubuntu2204-s-1vcpu-1gb-35gb-intel-tor1-01.ssh > 198.96.85.21.51536: Flags [P.], seq 56176:56364, ack 37, win 501, length 188
19:16:52.202775 IP lamponubuntu2204-s-1vcpu-1gb-35gb-intel-tor1-01.ssh > 198.96.85.21.51536: Flags [P.], seq 56364:56704, ack 37, win 501, length 340
19:16:52.202823 IP lamponubuntu2204-s-1vcpu-1gb-35gb-intel-tor1-01.ssh > 198.96.85.21.51536: Flags [P.], seq 56704:56892, ack 37, win 501, length 188
19:16:52.202883 IP lamponubuntu2204-s-1vcpu-1gb-35gb-intel-tor1-01.ssh > 198.96.85.21.51536: Flags [P.], seq 56892:57384, ack 37, win 501, length 492
19:16:52.202925 IP lamponubuntu2204-s-1vcpu-1gb-35gb-intel-tor1-01.ssh > 198.96.85.21.51536: Flags [P.], seq 57384:57724, ack 37, win 501, length 340
19:16:52.202967 IP lamponubuntu2204-s-1vcpu-1gb-35gb-intel-tor1-01.ssh > 198.96.85.21.51536: Flags [P.], seq 57724:58064, ack 37, win 501, length 340
19:16:52.203011 IP lamponubuntu2204-s-1vcpu-1gb-35gb-intel-tor1-01.ssh > 198.96.85.21.51536: Flags [P.], seq 58064:58404, ack 37, win 501, length 340
19:16:52.203052 IP lamponubuntu2204-s-1vcpu-1gb-35gb-intel-tor1-01.ssh > 198.96.85.21.51536: Flags [P.], seq 58404:58744, ack 37, win 501, length 340
19:16:52.203094 IP lamponubuntu2204-s-1vcpu-1gb-35gb-intel-tor1-01.ssh > 198.96.85.21.51536: Flags [P.], seq 58744:59084, ack 37, win 501, length 340
19:16:52.203140 IP lamponubuntu2204-s-1vcpu-1gb-35gb-intel-tor1-01.ssh > 198.96.85.21.51536: Flags [P.], seq 59084:59424, ack 37, win 501, length 340
19:16:52.226481 IP lamponubuntu2204-s-1vcpu-1gb-35gb-intel-tor1-01.ssh > 198.96.85.21.51536: Flags [P.], seq 59084:59424, ack 37, win 501, length 340
19:16:52.306682 IP lamponubuntu2204-s-1vcpu-1gb-35gb-intel-tor1-01.ssh > 198.96.85.21.51536: Flags [P.], seq 59424:59612, ack 37, win 501, length 188
19:16:52.306829 IP lamponubuntu2204-s-1vcpu-1gb-35gb-intel-tor1-01.ssh > 198.96.85.21.51536: Flags [P.], seq 59612:59800, ack 37, win 501, length 188
19:16:52.306928 IP lamponubuntu2204-s-1vcpu-1gb-35gb-intel-tor1-01.ssh > 198.96.85.21.51536: Flags [P.], seq 59800:60292, ack 37, win 501, length 492
19:16:52.307035 IP lamponubuntu2204-s-1vcpu-1gb-35gb-intel-tor1-01.ssh > 198.96.85.21.51536: Flags [P.], seq 60292:60936, ack 37, win 501, length 644
19:16:52.307118 IP lamponubuntu2204-s-1vcpu-1gb-35gb-intel-tor1-01.ssh > 198.96.85.21.51536: Flags [P.], seq 60936:61276, ack 37, win 501, length 340
19:16:52.410730 IP lamponubuntu2204-s-1vcpu-1gb-35gb-intel-tor1-01.ssh > 198.96.85.21.51536: Flags [P.], seq 61276:61464, ack 37, win 501, length 188
19:16:52.410788 IP lamponubuntu2204-s-1vcpu-1gb-35gb-intel-tor1-01.ssh > 198.96.85.21.51536: Flags [P.], seq 61464:61500, ack 37, win 501, length 36
19:16:52.410835 IP lamponubuntu2204-s-1vcpu-1gb-35gb-intel-tor1-01.ssh > 198.96.85.21.51536: Flags [P.], seq 61500:61688, ack 37, win 501, length 188
19:16:52.410863 IP lamponubuntu2204-s-1vcpu-1gb-35gb-intel-tor1-01.ssh > 198.96.85.21.51536: Flags [P.], seq 61688:61724, ack 37, win 501, length 36
19:16:52.410894 IP lamponubuntu2204-s-1vcpu-1gb-35gb-intel-tor1-01.ssh > 198.96.85.21.51536: Flags [P.], seq 61724:61912, ack 37, win 501, length 188
19:16:52.410927 IP lamponubuntu2204-s-1vcpu-1gb-35gb-intel-tor1-01.ssh > 198.96.85.21.51536: Flags [P.], seq 61912:62100, ack 37, win 501, length 188
19:16:52.410966 IP lamponubuntu2204-s-1vcpu-1gb-35gb-intel-tor1-01.ssh > 198.96.85.21.51536: Flags [P.], seq 62100:62288, ack 37, win 501, length 188
19:16:52.434495 IP lamponubuntu2204-s-1vcpu-1gb-35gb-intel-tor1-01.ssh > 198.96.85.21.51536: Flags [P.], seq 62100:62288, ack 37, win 501, length 188
19:16:52.514667 IP lamponubuntu2204-s-1vcpu-1gb-35gb-intel-tor1-01.ssh > 198.96.85.21.51536: Flags [P.], seq 62288:62476, ack 37, win 501, length 188
19:16:52.514793 IP lamponubuntu2204-s-1vcpu-1gb-35gb-intel-tor1-01.ssh > 198.96.85.21.51536: Flags [P.], seq 62476:62968, ack 37, win 501, length 492
19:16:52.514865 IP lamponubuntu2204-s-1vcpu-1gb-35gb-intel-tor1-01.ssh > 198.96.85.21.51536: Flags [P.], seq 62968:63612, ack 37, win 501, length 644
19:16:52.618664 IP lamponubuntu2204-s-1vcpu-1gb-35gb-intel-tor1-01.ssh > 198.96.85.21.51536: Flags [P.], seq 63612:63800, ack 37, win 501, length 188
19:16:52.618744 IP lamponubuntu2204-s-1vcpu-1gb-35gb-intel-tor1-01.ssh > 198.96.85.21.51536: Flags [P.], seq 63800:63988, ack 37, win 501, length 188
19:16:52.618769 IP lamponubuntu2204-s-1vcpu-1gb-35gb-intel-tor1-01.ssh > 198.96.85.21.51536: Flags [P.], seq 63988:64024, ack 37, win 501, length 36
19:16:52.618807 IP lamponubuntu2204-s-1vcpu-1gb-35gb-intel-tor1-01.ssh > 198.96.85.21.51536: Flags [P.], seq 64024:64212, ack 37, win 501, length 188
19:16:52.618833 IP lamponubuntu2204-s-1vcpu-1gb-35gb-intel-tor1-01.ssh > 198.96.85.21.51536: Flags [P.], seq 64212:64248, ack 37, win 501, length 36
19:16:52.642474 IP lamponubuntu2204-s-1vcpu-1gb-35gb-intel-tor1-01.ssh > 198.96.85.21.51536: Flags [P.], seq 64212:64248, ack 37, win 501, length 36
19:16:52.722717 IP lamponubuntu2204-s-1vcpu-1gb-35gb-intel-tor1-01.ssh > 198.96.85.21.51536: Flags [P.], seq 64248:64436, ack 37, win 501, length 188
19:16:52.722845 IP lamponubuntu2204-s-1vcpu-1gb-35gb-intel-tor1-01.ssh > 198.96.85.21.51536: Flags [P.], seq 64436:64776, ack 37, win 501, length 340
19:16:52.722958 IP lamponubuntu2204-s-1vcpu-1gb-35gb-intel-tor1-01.ssh > 198.96.85.21.51536: Flags [P.], seq 64776:65268, ack 37, win 501, length 492
19:16:52.826725 IP lamponubuntu2204-s-1vcpu-1gb-35gb-intel-tor1-01.ssh > 198.96.85.21.51536: Flags [P.], seq 65268:65456, ack 37, win 501, length 188
19:16:52.826791 IP lamponubuntu2204-s-1vcpu-1gb-35gb-intel-tor1-01.ssh > 198.96.85.21.51536: Flags [P.], seq 65456:65492, ack 37, win 501, length 36
19:16:52.826873 IP lamponubuntu2204-s-1vcpu-1gb-35gb-intel-tor1-01.ssh > 198.96.85.21.51536: Flags [P.], seq 65492:65832, ack 37, win 501, length 340
19:16:52.826924 IP lamponubuntu2204-s-1vcpu-1gb-35gb-intel-tor1-01.ssh > 198.96.85.21.51536: Flags [P.], seq 65832:65868, ack 37, win 501, length 36
19:16:52.930656 IP lamponubuntu2204-s-1vcpu-1gb-35gb-intel-tor1-01.ssh > 198.96.85.21.51536: Flags [P.], seq 65868:66056, ack 37, win 501, length 188
19:16:52.930755 IP lamponubuntu2204-s-1vcpu-1gb-35gb-intel-tor1-01.ssh > 198.96.85.21.51536: Flags [P.], seq 66056:66548, ack 37, win 501, length 492
19:16:52.954471 IP lamponubuntu2204-s-1vcpu-1gb-35gb-intel-tor1-01.ssh > 198.96.85.21.51536: Flags [P.], seq 66056:66548, ack 37, win 501, length 492
19:16:53.034660 IP lamponubuntu2204-s-1vcpu-1gb-35gb-intel-tor1-01.ssh > 198.96.85.21.51536: Flags [P.], seq 66548:66736, ack 37, win 501, length 188
19:16:53.034805 IP lamponubuntu2204-s-1vcpu-1gb-35gb-intel-tor1-01.ssh > 198.96.85.21.51536: Flags [P.], seq 66736:67076, ack 37, win 501, length 340
19:16:53.034859 IP lamponubuntu2204-s-1vcpu-1gb-35gb-intel-tor1-01.ssh > 198.96.85.21.51536: Flags [P.], seq 67076:67112, ack 37, win 501, length 36
19:16:53.138744 IP lamponubuntu2204-s-1vcpu-1gb-35gb-intel-tor1-01.ssh > 198.96.85.21.51536: Flags [P.], seq 67112:67300, ack 37, win 501, length 188
19:16:53.138836 IP lamponubuntu2204-s-1vcpu-1gb-35gb-intel-tor1-01.ssh > 198.96.85.21.51536: Flags [P.], seq 67300:67640, ack 37, win 501, length 340
19:16:53.242636 IP lamponubuntu2204-s-1vcpu-1gb-35gb-intel-tor1-01.ssh > 198.96.85.21.51536: Flags [P.], seq 67640:67828, ack 37, win 501, length 188
19:16:53.242713 IP lamponubuntu2204-s-1vcpu-1gb-35gb-intel-tor1-01.ssh > 198.96.85.21.51536: Flags [P.], seq 67828:68016, ack 37, win 501, length 188
19:16:53.262471 IP lamponubuntu2204-s-1vcpu-1gb-35gb-intel-tor1-01.ssh > 198.96.85.21.51536: Flags [P.], seq 67828:68016, ack 37, win 501, length 188
^C
363 packets captured
365 packets received by filter
0 packets dropped by kernel
