root@lamponubuntu2204-s-1vcpu-1gb-35gb-intel-tor1-01:~# tcpdump -n -i eth0
tcpdump: verbose output suppressed, use -v[v]... for full protocol decode
listening on eth0, link-type EN10MB (Ethernet), snapshot length 262144 bytes
19:13:06.346163 IP 165.227.42.177.22 > 198.96.85.21.51536: Flags [P.], seq 2061439511:2061439619, ack 2060787628, win 501, length 108
19:13:06.346226 IP 165.227.42.177.22 > 198.96.85.21.51536: Flags [P.], seq 108:144, ack 1, win 501, length 36
19:13:06.346266 IP 165.227.42.177.22 > 198.96.85.21.51536: Flags [P.], seq 144:196, ack 1, win 501, length 52
19:13:06.346300 IP 165.227.42.177.22 > 198.96.85.21.51536: Flags [P.], seq 196:264, ack 1, win 501, length 68
19:13:06.346338 IP 165.227.42.177.22 > 198.96.85.21.51536: Flags [P.], seq 264:332, ack 1, win 501, length 68
19:13:06.346369 IP 165.227.42.177.22 > 198.96.85.21.51536: Flags [P.], seq 332:368, ack 1, win 501, length 36
19:13:06.349236 IP 198.96.85.21.51536 > 165.227.42.177.22: Flags [.], ack 368, win 2050, length 0
19:13:06.446747 IP 165.227.42.177.22 > 198.96.85.21.51536: Flags [P.], seq 368:540, ack 1, win 501, length 172
19:13:06.446807 IP 165.227.42.177.22 > 198.96.85.21.51536: Flags [P.], seq 540:576, ack 1, win 501, length 36
19:13:06.446841 IP 165.227.42.177.22 > 198.96.85.21.51536: Flags [P.], seq 576:724, ack 1, win 501, length 148
19:13:06.446863 IP 165.227.42.177.22 > 198.96.85.21.51536: Flags [P.], seq 724:760, ack 1, win 501, length 36
19:13:06.446893 IP 165.227.42.177.22 > 198.96.85.21.51536: Flags [P.], seq 760:908, ack 1, win 501, length 148
19:13:06.446914 IP 165.227.42.177.22 > 198.96.85.21.51536: Flags [P.], seq 908:944, ack 1, win 501, length 36
19:13:06.446943 IP 165.227.42.177.22 > 198.96.85.21.51536: Flags [P.], seq 944:1092, ack 1, win 501, length 148
19:13:06.446964 IP 165.227.42.177.22 > 198.96.85.21.51536: Flags [P.], seq 1092:1128, ack 1, win 501, length 36
19:13:06.446993 IP 165.227.42.177.22 > 198.96.85.21.51536: Flags [P.], seq 1128:1276, ack 1, win 501, length 148
19:13:06.447015 IP 165.227.42.177.22 > 198.96.85.21.51536: Flags [P.], seq 1276:1312, ack 1, win 501, length 36
19:13:06.447047 IP 165.227.42.177.22 > 198.96.85.21.51536: Flags [P.], seq 1312:1460, ack 1, win 501, length 148
19:13:06.447068 IP 165.227.42.177.22 > 198.96.85.21.51536: Flags [P.], seq 1460:1496, ack 1, win 501, length 36
19:13:06.447097 IP 165.227.42.177.22 > 198.96.85.21.51536: Flags [P.], seq 1496:1628, ack 1, win 501, length 132
19:13:06.447117 IP 165.227.42.177.22 > 198.96.85.21.51536: Flags [P.], seq 1628:1664, ack 1, win 501, length 36
19:13:06.450281 IP 198.96.85.21.51536 > 165.227.42.177.22: Flags [.], ack 1664, win 2050, length 0
19:13:06.550659 IP 165.227.42.177.22 > 198.96.85.21.51536: Flags [P.], seq 1664:1812, ack 1, win 501, length 148
19:13:06.550749 IP 165.227.42.177.22 > 198.96.85.21.51536: Flags [P.], seq 1812:1996, ack 1, win 501, length 184
19:13:06.550832 IP 165.227.42.177.22 > 198.96.85.21.51536: Flags [P.], seq 1996:2032, ack 1, win 501, length 36
19:13:06.550862 IP 165.227.42.177.22 > 198.96.85.21.51536: Flags [P.], seq 2032:2180, ack 1, win 501, length 148
19:13:06.550893 IP 165.227.42.177.22 > 198.96.85.21.51536: Flags [P.], seq 2180:2216, ack 1, win 501, length 36
19:13:06.550935 IP 165.227.42.177.22 > 198.96.85.21.51536: Flags [P.], seq 2216:2364, ack 1, win 501, length 148
19:13:06.550993 IP 165.227.42.177.22 > 198.96.85.21.51536: Flags [P.], seq 2364:2548, ack 1, win 501, length 184
19:13:06.551114 IP 165.227.42.177.22 > 198.96.85.21.51536: Flags [P.], seq 2548:2584, ack 1, win 501, length 36
19:13:06.551161 IP 165.227.42.177.22 > 198.96.85.21.51536: Flags [P.], seq 2584:2732, ack 1, win 501, length 148
19:13:06.551201 IP 165.227.42.177.22 > 198.96.85.21.51536: Flags [P.], seq 2732:2768, ack 1, win 501, length 36
19:13:06.551269 IP 165.227.42.177.22 > 198.96.85.21.51536: Flags [P.], seq 2768:2916, ack 1, win 501, length 148
19:13:06.551300 IP 165.227.42.177.22 > 198.96.85.21.51536: Flags [P.], seq 2916:2952, ack 1, win 501, length 36
19:13:06.551341 IP 165.227.42.177.22 > 198.96.85.21.51536: Flags [P.], seq 2952:3100, ack 1, win 501, length 148
19:13:06.551371 IP 165.227.42.177.22 > 198.96.85.21.51536: Flags [P.], seq 3100:3136, ack 1, win 501, length 36
19:13:06.551443 IP 165.227.42.177.22 > 198.96.85.21.51536: Flags [P.], seq 3136:3284, ack 1, win 501, length 148
19:13:06.551474 IP 165.227.42.177.22 > 198.96.85.21.51536: Flags [P.], seq 3284:3320, ack 1, win 501, length 36
19:13:06.551545 IP 165.227.42.177.22 > 198.96.85.21.51536: Flags [P.], seq 3320:3468, ack 1, win 501, length 148
19:13:06.551575 IP 165.227.42.177.22 > 198.96.85.21.51536: Flags [P.], seq 3468:3504, ack 1, win 501, length 36
19:13:06.551617 IP 165.227.42.177.22 > 198.96.85.21.51536: Flags [P.], seq 3504:3652, ack 1, win 501, length 148
19:13:06.551654 IP 165.227.42.177.22 > 198.96.85.21.51536: Flags [P.], seq 3652:3688, ack 1, win 501, length 36
19:13:06.551700 IP 165.227.42.177.22 > 198.96.85.21.51536: Flags [P.], seq 3688:3836, ack 1, win 501, length 148
19:13:06.551729 IP 165.227.42.177.22 > 198.96.85.21.51536: Flags [P.], seq 3836:3872, ack 1, win 501, length 36
19:13:06.551770 IP 165.227.42.177.22 > 198.96.85.21.51536: Flags [P.], seq 3872:4020, ack 1, win 501, length 148
19:13:06.551800 IP 165.227.42.177.22 > 198.96.85.21.51536: Flags [P.], seq 4020:4056, ack 1, win 501, length 36
19:13:06.551857 IP 165.227.42.177.22 > 198.96.85.21.51536: Flags [P.], seq 4056:4204, ack 1, win 501, length 148
19:13:06.551929 IP 165.227.42.177.22 > 198.96.85.21.51536: Flags [P.], seq 4204:4372, ack 1, win 501, length 168
19:13:06.552069 IP 165.227.42.177.22 > 198.96.85.21.51536: Flags [P.], seq 4372:4408, ack 1, win 501, length 36
19:13:06.603100 IP 198.96.85.21.51536 > 165.227.42.177.22: Flags [.], ack 4408, win 2050, length 0
19:13:06.654675 IP 165.227.42.177.22 > 198.96.85.21.51536: Flags [P.], seq 4408:4556, ack 1, win 501, length 148
19:13:06.654745 IP 165.227.42.177.22 > 198.96.85.21.51536: Flags [P.], seq 4556:4592, ack 1, win 501, length 36
19:13:06.654800 IP 165.227.42.177.22 > 198.96.85.21.51536: Flags [P.], seq 4592:4740, ack 1, win 501, length 148
19:13:06.654823 IP 165.227.42.177.22 > 198.96.85.21.51536: Flags [P.], seq 4740:4776, ack 1, win 501, length 36
19:13:06.654852 IP 165.227.42.177.22 > 198.96.85.21.51536: Flags [P.], seq 4776:4924, ack 1, win 501, length 148
19:13:06.654873 IP 165.227.42.177.22 > 198.96.85.21.51536: Flags [P.], seq 4924:4960, ack 1, win 501, length 36
19:13:06.654928 IP 165.227.42.177.22 > 198.96.85.21.51536: Flags [P.], seq 4960:5108, ack 1, win 501, length 148
19:13:06.654951 IP 165.227.42.177.22 > 198.96.85.21.51536: Flags [P.], seq 5108:5144, ack 1, win 501, length 36
19:13:06.654983 IP 165.227.42.177.22 > 198.96.85.21.51536: Flags [P.], seq 5144:5292, ack 1, win 501, length 148
19:13:06.655004 IP 165.227.42.177.22 > 198.96.85.21.51536: Flags [P.], seq 5292:5328, ack 1, win 501, length 36
19:13:06.655033 IP 165.227.42.177.22 > 198.96.85.21.51536: Flags [P.], seq 5328:5476, ack 1, win 501, length 148
19:13:06.655054 IP 165.227.42.177.22 > 198.96.85.21.51536: Flags [P.], seq 5476:5512, ack 1, win 501, length 36
19:13:06.655086 IP 165.227.42.177.22 > 198.96.85.21.51536: Flags [P.], seq 5512:5660, ack 1, win 501, length 148
19:13:06.655107 IP 165.227.42.177.22 > 198.96.85.21.51536: Flags [P.], seq 5660:5696, ack 1, win 501, length 36
19:13:06.655137 IP 165.227.42.177.22 > 198.96.85.21.51536: Flags [P.], seq 5696:5844, ack 1, win 501, length 148
19:13:06.655161 IP 165.227.42.177.22 > 198.96.85.21.51536: Flags [P.], seq 5844:5880, ack 1, win 501, length 36
19:13:06.655191 IP 165.227.42.177.22 > 198.96.85.21.51536: Flags [P.], seq 5880:6028, ack 1, win 501, length 148
19:13:06.655212 IP 165.227.42.177.22 > 198.96.85.21.51536: Flags [P.], seq 6028:6064, ack 1, win 501, length 36
19:13:06.655246 IP 165.227.42.177.22 > 198.96.85.21.51536: Flags [P.], seq 6064:6212, ack 1, win 501, length 148
19:13:06.655281 IP 165.227.42.177.22 > 198.96.85.21.51536: Flags [P.], seq 6212:6248, ack 1, win 501, length 36
19:13:06.655328 IP 165.227.42.177.22 > 198.96.85.21.51536: Flags [P.], seq 6248:6396, ack 1, win 501, length 148
19:13:06.655357 IP 165.227.42.177.22 > 198.96.85.21.51536: Flags [P.], seq 6396:6432, ack 1, win 501, length 36
19:13:06.655388 IP 165.227.42.177.22 > 198.96.85.21.51536: Flags [P.], seq 6432:6580, ack 1, win 501, length 148
19:13:06.655410 IP 165.227.42.177.22 > 198.96.85.21.51536: Flags [P.], seq 6580:6616, ack 1, win 501, length 36
19:13:06.655439 IP 165.227.42.177.22 > 198.96.85.21.51536: Flags [P.], seq 6616:6764, ack 1, win 501, length 148
19:13:06.655460 IP 165.227.42.177.22 > 198.96.85.21.51536: Flags [P.], seq 6764:6800, ack 1, win 501, length 36
19:13:06.655488 IP 165.227.42.177.22 > 198.96.85.21.51536: Flags [P.], seq 6800:6948, ack 1, win 501, length 148
19:13:06.655510 IP 165.227.42.177.22 > 198.96.85.21.51536: Flags [P.], seq 6948:6984, ack 1, win 501, length 36
19:13:06.655538 IP 165.227.42.177.22 > 198.96.85.21.51536: Flags [P.], seq 6984:7132, ack 1, win 501, length 148
19:13:06.655561 IP 165.227.42.177.22 > 198.96.85.21.51536: Flags [P.], seq 7132:7168, ack 1, win 501, length 36
19:13:06.655602 IP 165.227.42.177.22 > 198.96.85.21.51536: Flags [P.], seq 7168:7316, ack 1, win 501, length 148
19:13:06.655627 IP 165.227.42.177.22 > 198.96.85.21.51536: Flags [P.], seq 7316:7352, ack 1, win 501, length 36
19:13:06.655657 IP 165.227.42.177.22 > 198.96.85.21.51536: Flags [P.], seq 7352:7500, ack 1, win 501, length 148
19:13:06.655678 IP 165.227.42.177.22 > 198.96.85.21.51536: Flags [P.], seq 7500:7536, ack 1, win 501, length 36
19:13:06.655707 IP 165.227.42.177.22 > 198.96.85.21.51536: Flags [P.], seq 7536:7684, ack 1, win 501, length 148
19:13:06.655729 IP 165.227.42.177.22 > 198.96.85.21.51536: Flags [P.], seq 7684:7720, ack 1, win 501, length 36
19:13:06.655757 IP 165.227.42.177.22 > 198.96.85.21.51536: Flags [P.], seq 7720:7868, ack 1, win 501, length 148
19:13:06.655778 IP 165.227.42.177.22 > 198.96.85.21.51536: Flags [P.], seq 7868:7904, ack 1, win 501, length 36
19:13:06.655807 IP 165.227.42.177.22 > 198.96.85.21.51536: Flags [P.], seq 7904:8052, ack 1, win 501, length 148
19:13:06.655828 IP 165.227.42.177.22 > 198.96.85.21.51536: Flags [P.], seq 8052:8088, ack 1, win 501, length 36
19:13:06.655881 IP 165.227.42.177.22 > 198.96.85.21.51536: Flags [P.], seq 8088:8236, ack 1, win 501, length 148
19:13:06.655921 IP 165.227.42.177.22 > 198.96.85.21.51536: Flags [P.], seq 8236:8272, ack 1, win 501, length 36
19:13:06.655937 IP 165.227.42.177.22 > 198.96.85.21.51536: Flags [P.], seq 8272:8420, ack 1, win 501, length 148
19:13:06.655972 IP 165.227.42.177.22 > 198.96.85.21.51536: Flags [P.], seq 8420:8456, ack 1, win 501, length 36
19:13:06.655991 IP 165.227.42.177.22 > 198.96.85.21.51536: Flags [P.], seq 8456:8604, ack 1, win 501, length 148
19:13:06.656013 IP 165.227.42.177.22 > 198.96.85.21.51536: Flags [P.], seq 8604:8640, ack 1, win 501, length 36
19:13:06.656046 IP 165.227.42.177.22 > 198.96.85.21.51536: Flags [P.], seq 8640:8788, ack 1, win 501, length 148
19:13:06.656067 IP 165.227.42.177.22 > 198.96.85.21.51536: Flags [P.], seq 8788:8824, ack 1, win 501, length 36
19:13:06.656096 IP 165.227.42.177.22 > 198.96.85.21.51536: Flags [P.], seq 8824:8972, ack 1, win 501, length 148
19:13:06.656117 IP 165.227.42.177.22 > 198.96.85.21.51536: Flags [P.], seq 8972:9008, ack 1, win 501, length 36
19:13:06.656145 IP 165.227.42.177.22 > 198.96.85.21.51536: Flags [P.], seq 9008:9156, ack 1, win 501, length 148
19:13:06.656166 IP 165.227.42.177.22 > 198.96.85.21.51536: Flags [P.], seq 9156:9192, ack 1, win 501, length 36
19:13:06.656193 IP 165.227.42.177.22 > 198.96.85.21.51536: Flags [P.], seq 9192:9340, ack 1, win 501, length 148
19:13:06.656213 IP 165.227.42.177.22 > 198.96.85.21.51536: Flags [P.], seq 9340:9376, ack 1, win 501, length 36
19:13:06.656248 IP 165.227.42.177.22 > 198.96.85.21.51536: Flags [P.], seq 9376:9508, ack 1, win 501, length 132
19:13:06.656270 IP 165.227.42.177.22 > 198.96.85.21.51536: Flags [P.], seq 9508:9544, ack 1, win 501, length 36
19:13:06.659603 IP 198.96.85.21.51536 > 165.227.42.177.22: Flags [.], ack 7352, win 2050, length 0
19:13:06.659856 IP 198.96.85.21.51536 > 165.227.42.177.22: Flags [.], ack 9544, win 2050, length 0
19:13:06.758652 IP 165.227.42.177.22 > 198.96.85.21.51536: Flags [P.], seq 9544:9692, ack 1, win 501, length 148
19:13:06.758731 IP 165.227.42.177.22 > 198.96.85.21.51536: Flags [P.], seq 9692:9728, ack 1, win 501, length 36
19:13:06.758781 IP 165.227.42.177.22 > 198.96.85.21.51536: Flags [P.], seq 9728:9876, ack 1, win 501, length 148
19:13:06.758804 IP 165.227.42.177.22 > 198.96.85.21.51536: Flags [P.], seq 9876:9912, ack 1, win 501, length 36
19:13:06.758833 IP 165.227.42.177.22 > 198.96.85.21.51536: Flags [P.], seq 9912:10060, ack 1, win 501, length 148
19:13:06.758867 IP 165.227.42.177.22 > 198.96.85.21.51536: Flags [P.], seq 10060:10096, ack 1, win 501, length 36
19:13:06.758888 IP 165.227.42.177.22 > 198.96.85.21.51536: Flags [P.], seq 10096:10244, ack 1, win 501, length 148
19:13:06.758909 IP 165.227.42.177.22 > 198.96.85.21.51536: Flags [P.], seq 10244:10280, ack 1, win 501, length 36
19:13:06.758939 IP 165.227.42.177.22 > 198.96.85.21.51536: Flags [P.], seq 10280:10428, ack 1, win 501, length 148
19:13:06.758959 IP 165.227.42.177.22 > 198.96.85.21.51536: Flags [P.], seq 10428:10464, ack 1, win 501, length 36
19:13:06.758987 IP 165.227.42.177.22 > 198.96.85.21.51536: Flags [P.], seq 10464:10612, ack 1, win 501, length 148
19:13:06.759008 IP 165.227.42.177.22 > 198.96.85.21.51536: Flags [P.], seq 10612:10648, ack 1, win 501, length 36
19:13:06.759036 IP 165.227.42.177.22 > 198.96.85.21.51536: Flags [P.], seq 10648:10796, ack 1, win 501, length 148
19:13:06.759057 IP 165.227.42.177.22 > 198.96.85.21.51536: Flags [P.], seq 10796:10832, ack 1, win 501, length 36
19:13:06.759085 IP 165.227.42.177.22 > 198.96.85.21.51536: Flags [P.], seq 10832:10980, ack 1, win 501, length 148
19:13:06.759144 IP 165.227.42.177.22 > 198.96.85.21.51536: Flags [P.], seq 10980:11016, ack 1, win 501, length 36
19:13:06.759175 IP 165.227.42.177.22 > 198.96.85.21.51536: Flags [P.], seq 11016:11164, ack 1, win 501, length 148
19:13:06.759196 IP 165.227.42.177.22 > 198.96.85.21.51536: Flags [P.], seq 11164:11200, ack 1, win 501, length 36
19:13:06.759232 IP 165.227.42.177.22 > 198.96.85.21.51536: Flags [P.], seq 11200:11348, ack 1, win 501, length 148
19:13:06.759255 IP 165.227.42.177.22 > 198.96.85.21.51536: Flags [P.], seq 11348:11384, ack 1, win 501, length 36
19:13:06.759284 IP 165.227.42.177.22 > 198.96.85.21.51536: Flags [P.], seq 11384:11532, ack 1, win 501, length 148
19:13:06.759305 IP 165.227.42.177.22 > 198.96.85.21.51536: Flags [P.], seq 11532:11568, ack 1, win 501, length 36
19:13:06.759333 IP 165.227.42.177.22 > 198.96.85.21.51536: Flags [P.], seq 11568:11716, ack 1, win 501, length 148
19:13:06.759369 IP 165.227.42.177.22 > 198.96.85.21.51536: Flags [P.], seq 11716:11752, ack 1, win 501, length 36
19:13:06.759419 IP 165.227.42.177.22 > 198.96.85.21.51536: Flags [P.], seq 11752:11900, ack 1, win 501, length 148
19:13:06.759463 IP 165.227.42.177.22 > 198.96.85.21.51536: Flags [P.], seq 11900:12084, ack 1, win 501, length 184
19:13:06.759485 IP 165.227.42.177.22 > 198.96.85.21.51536: Flags [P.], seq 12084:12120, ack 1, win 501, length 36
19:13:06.759514 IP 165.227.42.177.22 > 198.96.85.21.51536: Flags [P.], seq 12120:12268, ack 1, win 501, length 148
19:13:06.759558 IP 165.227.42.177.22 > 198.96.85.21.51536: Flags [P.], seq 12268:12304, ack 1, win 501, length 36
19:13:06.759591 IP 165.227.42.177.22 > 198.96.85.21.51536: Flags [P.], seq 12304:12452, ack 1, win 501, length 148
19:13:06.759614 IP 165.227.42.177.22 > 198.96.85.21.51536: Flags [P.], seq 12452:12488, ack 1, win 501, length 36
19:13:06.759656 IP 165.227.42.177.22 > 198.96.85.21.51536: Flags [P.], seq 12488:12636, ack 1, win 501, length 148
19:13:06.759713 IP 165.227.42.177.22 > 198.96.85.21.51536: Flags [P.], seq 12636:12672, ack 1, win 501, length 36
19:13:06.759759 IP 165.227.42.177.22 > 198.96.85.21.51536: Flags [P.], seq 12672:12820, ack 1, win 501, length 148
19:13:06.759787 IP 165.227.42.177.22 > 198.96.85.21.51536: Flags [P.], seq 12820:12856, ack 1, win 501, length 36
19:13:06.759825 IP 165.227.42.177.22 > 198.96.85.21.51536: Flags [P.], seq 12856:13004, ack 1, win 501, length 148
19:13:06.759847 IP 165.227.42.177.22 > 198.96.85.21.51536: Flags [P.], seq 13004:13040, ack 1, win 501, length 36
19:13:06.759875 IP 165.227.42.177.22 > 198.96.85.21.51536: Flags [P.], seq 13040:13188, ack 1, win 501, length 148
19:13:06.759896 IP 165.227.42.177.22 > 198.96.85.21.51536: Flags [P.], seq 13188:13224, ack 1, win 501, length 36
19:13:06.759951 IP 165.227.42.177.22 > 198.96.85.21.51536: Flags [P.], seq 13224:13372, ack 1, win 501, length 148
19:13:06.759973 IP 165.227.42.177.22 > 198.96.85.21.51536: Flags [P.], seq 13372:13408, ack 1, win 501, length 36
19:13:06.760022 IP 165.227.42.177.22 > 198.96.85.21.51536: Flags [P.], seq 13408:13556, ack 1, win 501, length 148
19:13:06.760044 IP 165.227.42.177.22 > 198.96.85.21.51536: Flags [P.], seq 13556:13592, ack 1, win 501, length 36
19:13:06.760096 IP 165.227.42.177.22 > 198.96.85.21.51536: Flags [P.], seq 13592:13740, ack 1, win 501, length 148
19:13:06.760132 IP 165.227.42.177.22 > 198.96.85.21.51536: Flags [P.], seq 13740:13776, ack 1, win 501, length 36
19:13:06.760174 IP 165.227.42.177.22 > 198.96.85.21.51536: Flags [P.], seq 13776:13924, ack 1, win 501, length 148
19:13:06.760204 IP 165.227.42.177.22 > 198.96.85.21.51536: Flags [P.], seq 13924:13960, ack 1, win 501, length 36
19:13:06.760235 IP 165.227.42.177.22 > 198.96.85.21.51536: Flags [P.], seq 13960:14108, ack 1, win 501, length 148
19:13:06.760256 IP 165.227.42.177.22 > 198.96.85.21.51536: Flags [P.], seq 14108:14144, ack 1, win 501, length 36
19:13:06.760286 IP 165.227.42.177.22 > 198.96.85.21.51536: Flags [P.], seq 14144:14292, ack 1, win 501, length 148
19:13:06.760306 IP 165.227.42.177.22 > 198.96.85.21.51536: Flags [P.], seq 14292:14328, ack 1, win 501, length 36
19:13:06.760334 IP 165.227.42.177.22 > 198.96.85.21.51536: Flags [P.], seq 14328:14476, ack 1, win 501, length 148
19:13:06.760355 IP 165.227.42.177.22 > 198.96.85.21.51536: Flags [P.], seq 14476:14512, ack 1, win 501, length 36
19:13:06.760383 IP 165.227.42.177.22 > 198.96.85.21.51536: Flags [P.], seq 14512:14660, ack 1, win 501, length 148
19:13:06.760404 IP 165.227.42.177.22 > 198.96.85.21.51536: Flags [P.], seq 14660:14696, ack 1, win 501, length 36
19:13:06.760432 IP 165.227.42.177.22 > 198.96.85.21.51536: Flags [P.], seq 14696:14844, ack 1, win 501, length 148
19:13:06.760452 IP 165.227.42.177.22 > 198.96.85.21.51536: Flags [P.], seq 14844:14880, ack 1, win 501, length 36
19:13:06.760481 IP 165.227.42.177.22 > 198.96.85.21.51536: Flags [P.], seq 14880:15028, ack 1, win 501, length 148
19:13:06.760502 IP 165.227.42.177.22 > 198.96.85.21.51536: Flags [P.], seq 15028:15064, ack 1, win 501, length 36
19:13:06.760530 IP 165.227.42.177.22 > 198.96.85.21.51536: Flags [P.], seq 15064:15212, ack 1, win 501, length 148
19:13:06.760550 IP 165.227.42.177.22 > 198.96.85.21.51536: Flags [P.], seq 15212:15248, ack 1, win 501, length 36
19:13:06.760578 IP 165.227.42.177.22 > 198.96.85.21.51536: Flags [P.], seq 15248:15396, ack 1, win 501, length 148
19:13:06.760599 IP 165.227.42.177.22 > 198.96.85.21.51536: Flags [P.], seq 15396:15432, ack 1, win 501, length 36
19:13:06.760626 IP 165.227.42.177.22 > 198.96.85.21.51536: Flags [P.], seq 15432:15580, ack 1, win 501, length 148
19:13:06.760659 IP 165.227.42.177.22 > 198.96.85.21.51536: Flags [P.], seq 15580:15616, ack 1, win 501, length 36
19:13:06.760701 IP 165.227.42.177.22 > 198.96.85.21.51536: Flags [P.], seq 15616:15764, ack 1, win 501, length 148
19:13:06.760723 IP 165.227.42.177.22 > 198.96.85.21.51536: Flags [P.], seq 15764:15800, ack 1, win 501, length 36
19:13:06.760751 IP 165.227.42.177.22 > 198.96.85.21.51536: Flags [P.], seq 15800:15948, ack 1, win 501, length 148
19:13:06.760772 IP 165.227.42.177.22 > 198.96.85.21.51536: Flags [P.], seq 15948:15984, ack 1, win 501, length 36
19:13:06.760805 IP 165.227.42.177.22 > 198.96.85.21.51536: Flags [P.], seq 15984:16132, ack 1, win 501, length 148
19:13:06.760827 IP 165.227.42.177.22 > 198.96.85.21.51536: Flags [P.], seq 16132:16168, ack 1, win 501, length 36
19:13:06.760855 IP 165.227.42.177.22 > 198.96.85.21.51536: Flags [P.], seq 16168:16316, ack 1, win 501, length 148
19:13:06.760875 IP 165.227.42.177.22 > 198.96.85.21.51536: Flags [P.], seq 16316:16352, ack 1, win 501, length 36
19:13:06.760903 IP 165.227.42.177.22 > 198.96.85.21.51536: Flags [P.], seq 16352:16500, ack 1, win 501, length 148
19:13:06.760957 IP 165.227.42.177.22 > 198.96.85.21.51536: Flags [P.], seq 16500:16536, ack 1, win 501, length 36
19:13:06.760977 IP 165.227.42.177.22 > 198.96.85.21.51536: Flags [P.], seq 16536:16684, ack 1, win 501, length 148
19:13:06.761007 IP 165.227.42.177.22 > 198.96.85.21.51536: Flags [P.], seq 16684:16720, ack 1, win 501, length 36
19:13:06.761051 IP 165.227.42.177.22 > 198.96.85.21.51536: Flags [P.], seq 16720:16868, ack 1, win 501, length 148
19:13:06.761073 IP 165.227.42.177.22 > 198.96.85.21.51536: Flags [P.], seq 16868:16904, ack 1, win 501, length 36
19:13:06.761123 IP 165.227.42.177.22 > 198.96.85.21.51536: Flags [P.], seq 16904:17052, ack 1, win 501, length 148
19:13:06.761145 IP 165.227.42.177.22 > 198.96.85.21.51536: Flags [P.], seq 17052:17088, ack 1, win 501, length 36
19:13:06.761174 IP 165.227.42.177.22 > 198.96.85.21.51536: Flags [P.], seq 17088:17236, ack 1, win 501, length 148
19:13:06.761195 IP 165.227.42.177.22 > 198.96.85.21.51536: Flags [P.], seq 17236:17272, ack 1, win 501, length 36
19:13:06.761223 IP 165.227.42.177.22 > 198.96.85.21.51536: Flags [P.], seq 17272:17420, ack 1, win 501, length 148
19:13:06.761247 IP 165.227.42.177.22 > 198.96.85.21.51536: Flags [P.], seq 17420:17456, ack 1, win 501, length 36
19:13:06.761277 IP 165.227.42.177.22 > 198.96.85.21.51536: Flags [P.], seq 17456:17604, ack 1, win 501, length 148
19:13:06.761299 IP 165.227.42.177.22 > 198.96.85.21.51536: Flags [P.], seq 17604:17640, ack 1, win 501, length 36
19:13:06.761326 IP 165.227.42.177.22 > 198.96.85.21.51536: Flags [P.], seq 17640:17788, ack 1, win 501, length 148
19:13:06.761347 IP 165.227.42.177.22 > 198.96.85.21.51536: Flags [P.], seq 17788:17824, ack 1, win 501, length 36
19:13:06.761375 IP 165.227.42.177.22 > 198.96.85.21.51536: Flags [P.], seq 17824:17972, ack 1, win 501, length 148
19:13:06.761396 IP 165.227.42.177.22 > 198.96.85.21.51536: Flags [P.], seq 17972:18008, ack 1, win 501, length 36
19:13:06.761421 IP 165.227.42.177.22 > 198.96.85.21.51536: Flags [P.], seq 18008:18156, ack 1, win 501, length 148
19:13:06.761439 IP 165.227.42.177.22 > 198.96.85.21.51536: Flags [P.], seq 18156:18192, ack 1, win 501, length 36
19:13:06.761467 IP 165.227.42.177.22 > 198.96.85.21.51536: Flags [P.], seq 18192:18340, ack 1, win 501, length 148
19:13:06.761489 IP 165.227.42.177.22 > 198.96.85.21.51536: Flags [P.], seq 18340:18376, ack 1, win 501, length 36
19:13:06.761518 IP 165.227.42.177.22 > 198.96.85.21.51536: Flags [P.], seq 18376:18524, ack 1, win 501, length 148
19:13:06.761539 IP 165.227.42.177.22 > 198.96.85.21.51536: Flags [P.], seq 18524:18560, ack 1, win 501, length 36
19:13:06.761674 IP 165.227.42.177.22 > 198.96.85.21.51536: Flags [P.], seq 18560:18708, ack 1, win 501, length 148
19:13:06.761725 IP 165.227.42.177.22 > 198.96.85.21.51536: Flags [P.], seq 18708:18744, ack 1, win 501, length 36
19:13:06.761769 IP 165.227.42.177.22 > 198.96.85.21.51536: Flags [P.], seq 18744:18892, ack 1, win 501, length 148
19:13:06.761790 IP 165.227.42.177.22 > 198.96.85.21.51536: Flags [P.], seq 18892:18928, ack 1, win 501, length 36
19:13:06.761838 IP 165.227.42.177.22 > 198.96.85.21.51536: Flags [P.], seq 18928:19076, ack 1, win 501, length 148
19:13:06.761866 IP 165.227.42.177.22 > 198.96.85.21.51536: Flags [P.], seq 19076:19112, ack 1, win 501, length 36
19:13:06.761896 IP 165.227.42.177.22 > 198.96.85.21.51536: Flags [P.], seq 19112:19260, ack 1, win 501, length 148
19:13:06.761919 IP 165.227.42.177.22 > 198.96.85.21.51536: Flags [P.], seq 19260:19296, ack 1, win 501, length 36
19:13:06.761948 IP 165.227.42.177.22 > 198.96.85.21.51536: Flags [P.], seq 19296:19444, ack 1, win 501, length 148
19:13:06.761968 IP 165.227.42.177.22 > 198.96.85.21.51536: Flags [P.], seq 19444:19480, ack 1, win 501, length 36
19:13:06.761996 IP 165.227.42.177.22 > 198.96.85.21.51536: Flags [P.], seq 19480:19628, ack 1, win 501, length 148
19:13:06.762017 IP 165.227.42.177.22 > 198.96.85.21.51536: Flags [P.], seq 19628:19664, ack 1, win 501, length 36
19:13:06.762046 IP 165.227.42.177.22 > 198.96.85.21.51536: Flags [P.], seq 19664:19812, ack 1, win 501, length 148
19:13:06.762069 IP 165.227.42.177.22 > 198.96.85.21.51536: Flags [P.], seq 19812:19848, ack 1, win 501, length 36
19:13:06.762104 IP 165.227.42.177.22 > 198.96.85.21.51536: Flags [P.], seq 19848:19980, ack 1, win 501, length 132
19:13:06.762140 IP 165.227.42.177.22 > 198.96.85.21.51536: Flags [P.], seq 19980:20016, ack 1, win 501, length 36
19:13:06.762181 IP 165.227.42.177.22 > 198.96.85.21.51536: Flags [P.], seq 20016:20148, ack 1, win 501, length 132
19:13:06.801300 IP 198.96.85.21.51536 > 165.227.42.177.22: Flags [.], ack 12636, win 2050, length 0
19:13:06.801374 IP 165.227.42.177.22 > 198.96.85.21.51536: Flags [P.], seq 20148:20184, ack 1, win 501, length 36
19:13:06.801729 IP 198.96.85.21.51536 > 165.227.42.177.22: Flags [.], ack 15580, win 2050, length 0
19:13:06.801784 IP 198.96.85.21.51536 > 165.227.42.177.22: Flags [.], ack 18524, win 2050, length 0
19:13:06.802733 IP 198.96.85.21.51536 > 165.227.42.177.22: Flags [.], ack 20148, win 2050, length 0
19:13:06.846712 IP 198.96.85.21.51536 > 165.227.42.177.22: Flags [.], ack 20184, win 2050, length 0
19:13:06.862654 IP 165.227.42.177.22 > 198.96.85.21.51536: Flags [P.], seq 20184:20332, ack 1, win 501, length 148
19:13:06.862729 IP 165.227.42.177.22 > 198.96.85.21.51536: Flags [P.], seq 20332:20368, ack 1, win 501, length 36
19:13:06.862752 IP 165.227.42.177.22 > 198.96.85.21.51536: Flags [P.], seq 20368:20516, ack 1, win 501, length 148
19:13:06.862773 IP 165.227.42.177.22 > 198.96.85.21.51536: Flags [P.], seq 20516:20552, ack 1, win 501, length 36
19:13:06.862803 IP 165.227.42.177.22 > 198.96.85.21.51536: Flags [P.], seq 20552:20700, ack 1, win 501, length 148
19:13:06.862824 IP 165.227.42.177.22 > 198.96.85.21.51536: Flags [P.], seq 20700:20736, ack 1, win 501, length 36
19:13:06.862852 IP 165.227.42.177.22 > 198.96.85.21.51536: Flags [P.], seq 20736:20884, ack 1, win 501, length 148
19:13:06.862949 IP 165.227.42.177.22 > 198.96.85.21.51536: Flags [P.], seq 20884:20920, ack 1, win 501, length 36
19:13:06.862984 IP 165.227.42.177.22 > 198.96.85.21.51536: Flags [P.], seq 20920:21068, ack 1, win 501, length 148
19:13:06.863027 IP 165.227.42.177.22 > 198.96.85.21.51536: Flags [P.], seq 21068:21336, ack 1, win 501, length 268
19:13:06.863084 IP 165.227.42.177.22 > 198.96.85.21.51536: Flags [P.], seq 21336:21716, ack 1, win 501, length 380
19:13:06.863134 IP 165.227.42.177.22 > 198.96.85.21.51536: Flags [P.], seq 21716:22104, ack 1, win 501, length 388
19:13:06.863175 IP 165.227.42.177.22 > 198.96.85.21.51536: Flags [P.], seq 22104:22372, ack 1, win 501, length 268
19:13:06.863219 IP 165.227.42.177.22 > 198.96.85.21.51536: Flags [P.], seq 22372:22640, ack 1, win 501, length 268
19:13:06.863260 IP 165.227.42.177.22 > 198.96.85.21.51536: Flags [P.], seq 22640:22908, ack 1, win 501, length 268
19:13:06.863305 IP 165.227.42.177.22 > 198.96.85.21.51536: Flags [P.], seq 22908:23064, ack 1, win 501, length 156
19:13:06.863357 IP 165.227.42.177.22 > 198.96.85.21.51536: Flags [P.], seq 23064:23452, ack 1, win 501, length 388
19:13:06.863397 IP 165.227.42.177.22 > 198.96.85.21.51536: Flags [P.], seq 23452:23720, ack 1, win 501, length 268
19:13:06.863438 IP 165.227.42.177.22 > 198.96.85.21.51536: Flags [P.], seq 23720:23988, ack 1, win 501, length 268
19:13:06.863504 IP 165.227.42.177.22 > 198.96.85.21.51536: Flags [P.], seq 23988:24256, ack 1, win 501, length 268
19:13:06.863580 IP 165.227.42.177.22 > 198.96.85.21.51536: Flags [P.], seq 24256:24644, ack 1, win 501, length 388
19:13:06.863634 IP 165.227.42.177.22 > 198.96.85.21.51536: Flags [P.], seq 24644:25024, ack 1, win 501, length 380
19:13:06.863689 IP 165.227.42.177.22 > 198.96.85.21.51536: Flags [P.], seq 25024:25412, ack 1, win 501, length 388
19:13:06.863731 IP 165.227.42.177.22 > 198.96.85.21.51536: Flags [P.], seq 25412:25680, ack 1, win 501, length 268
19:13:06.863773 IP 165.227.42.177.22 > 198.96.85.21.51536: Flags [P.], seq 25680:25948, ack 1, win 501, length 268
19:13:06.863822 IP 165.227.42.177.22 > 198.96.85.21.51536: Flags [P.], seq 25948:26328, ack 1, win 501, length 380
19:13:06.863862 IP 165.227.42.177.22 > 198.96.85.21.51536: Flags [P.], seq 26328:26596, ack 1, win 501, length 268
19:13:06.863909 IP 165.227.42.177.22 > 198.96.85.21.51536: Flags [P.], seq 26596:26752, ack 1, win 501, length 156
19:13:06.863955 IP 165.227.42.177.22 > 198.96.85.21.51536: Flags [P.], seq 26752:27020, ack 1, win 501, length 268
19:13:06.863995 IP 165.227.42.177.22 > 198.96.85.21.51536: Flags [P.], seq 27020:27288, ack 1, win 501, length 268
19:13:06.864048 IP 165.227.42.177.22 > 198.96.85.21.51536: Flags [P.], seq 27288:27668, ack 1, win 501, length 380
19:13:06.864098 IP 165.227.42.177.22 > 198.96.85.21.51536: Flags [P.], seq 27668:28056, ack 1, win 501, length 388
19:13:06.864141 IP 165.227.42.177.22 > 198.96.85.21.51536: Flags [P.], seq 28056:28324, ack 1, win 501, length 268
19:13:06.864191 IP 165.227.42.177.22 > 198.96.85.21.51536: Flags [P.], seq 28324:28704, ack 1, win 501, length 380
19:13:06.864243 IP 165.227.42.177.22 > 198.96.85.21.51536: Flags [P.], seq 28704:29092, ack 1, win 501, length 388
19:13:06.864295 IP 165.227.42.177.22 > 198.96.85.21.51536: Flags [P.], seq 29092:29472, ack 1, win 501, length 380
19:13:06.864335 IP 165.227.42.177.22 > 198.96.85.21.51536: Flags [P.], seq 29472:29740, ack 1, win 501, length 268
19:13:06.864377 IP 165.227.42.177.22 > 198.96.85.21.51536: Flags [P.], seq 29740:30008, ack 1, win 501, length 268
19:13:06.864418 IP 165.227.42.177.22 > 198.96.85.21.51536: Flags [P.], seq 30008:30276, ack 1, win 501, length 268
19:13:06.864467 IP 165.227.42.177.22 > 198.96.85.21.51536: Flags [P.], seq 30276:30656, ack 1, win 501, length 380
19:13:06.864519 IP 165.227.42.177.22 > 198.96.85.21.51536: Flags [P.], seq 30656:31036, ack 1, win 501, length 380
19:13:06.864560 IP 165.227.42.177.22 > 198.96.85.21.51536: Flags [P.], seq 31036:31304, ack 1, win 501, length 268
19:13:06.864625 IP 165.227.42.177.22 > 198.96.85.21.51536: Flags [P.], seq 31304:31692, ack 1, win 501, length 388
19:13:06.864702 IP 165.227.42.177.22 > 198.96.85.21.51536: Flags [P.], seq 31692:32072, ack 1, win 501, length 380
19:13:06.864759 IP 165.227.42.177.22 > 198.96.85.21.51536: Flags [P.], seq 32072:32460, ack 1, win 501, length 388
19:13:06.864822 IP 165.227.42.177.22 > 198.96.85.21.51536: Flags [P.], seq 32460:32728, ack 1, win 501, length 268
19:13:06.864891 IP 165.227.42.177.22 > 198.96.85.21.51536: Flags [P.], seq 32728:33108, ack 1, win 501, length 380
19:13:06.864949 IP 165.227.42.177.22 > 198.96.85.21.51536: Flags [P.], seq 33108:33376, ack 1, win 501, length 268
19:13:06.865026 IP 165.227.42.177.22 > 198.96.85.21.51536: Flags [P.], seq 33376:33764, ack 1, win 501, length 388
19:13:06.865089 IP 165.227.42.177.22 > 198.96.85.21.51536: Flags [P.], seq 33764:34264, ack 1, win 501, length 500
19:13:06.865141 IP 165.227.42.177.22 > 198.96.85.21.51536: Flags [P.], seq 34264:34644, ack 1, win 501, length 380
19:13:06.865194 IP 165.227.42.177.22 > 198.96.85.21.51536: Flags [P.], seq 34644:35032, ack 1, win 501, length 388
19:13:06.865236 IP 165.227.42.177.22 > 198.96.85.21.51536: Flags [P.], seq 35032:35300, ack 1, win 501, length 268
19:13:06.865278 IP 165.227.42.177.22 > 198.96.85.21.51536: Flags [P.], seq 35300:35552, ack 1, win 501, length 252
19:13:06.865319 IP 165.227.42.177.22 > 198.96.85.21.51536: Flags [P.], seq 35552:35788, ack 1, win 501, length 236
19:13:06.865369 IP 165.227.42.177.22 > 198.96.85.21.51536: Flags [P.], seq 35788:36032, ack 1, win 501, length 244
19:13:06.867855 IP 198.96.85.21.51536 > 165.227.42.177.22: Flags [.], ack 28056, win 2050, length 0
19:13:06.867856 IP 198.96.85.21.51536 > 165.227.42.177.22: Flags [.], ack 29472, win 2050, length 0
19:13:06.868213 IP 198.96.85.21.51536 > 165.227.42.177.22: Flags [.], ack 36032, win 2050, length 0
19:13:06.966663 IP 165.227.42.177.22 > 198.96.85.21.51536: Flags [P.], seq 36032:36180, ack 1, win 501, length 148
19:13:06.966719 IP 165.227.42.177.22 > 198.96.85.21.51536: Flags [P.], seq 36180:36216, ack 1, win 501, length 36
19:13:06.966754 IP 165.227.42.177.22 > 198.96.85.21.51536: Flags [P.], seq 36216:36364, ack 1, win 501, length 148
19:13:06.966777 IP 165.227.42.177.22 > 198.96.85.21.51536: Flags [P.], seq 36364:36400, ack 1, win 501, length 36
19:13:06.966807 IP 165.227.42.177.22 > 198.96.85.21.51536: Flags [P.], seq 36400:36548, ack 1, win 501, length 148
19:13:06.966828 IP 165.227.42.177.22 > 198.96.85.21.51536: Flags [P.], seq 36548:36584, ack 1, win 501, length 36
19:13:06.966871 IP 165.227.42.177.22 > 198.96.85.21.51536: Flags [P.], seq 36584:36732, ack 1, win 501, length 148
19:13:06.966936 IP 165.227.42.177.22 > 198.96.85.21.51536: Flags [P.], seq 36732:37120, ack 1, win 501, length 388
19:13:06.967001 IP 165.227.42.177.22 > 198.96.85.21.51536: Flags [P.], seq 37120:37620, ack 1, win 501, length 500
19:13:06.967052 IP 165.227.42.177.22 > 198.96.85.21.51536: Flags [P.], seq 37620:38008, ack 1, win 501, length 388
19:13:06.967093 IP 165.227.42.177.22 > 198.96.85.21.51536: Flags [P.], seq 38008:38276, ack 1, win 501, length 268
19:13:06.967138 IP 165.227.42.177.22 > 198.96.85.21.51536: Flags [P.], seq 38276:38544, ack 1, win 501, length 268
19:13:06.967201 IP 165.227.42.177.22 > 198.96.85.21.51536: Flags [P.], seq 38544:38812, ack 1, win 501, length 268
19:13:06.967254 IP 165.227.42.177.22 > 198.96.85.21.51536: Flags [P.], seq 38812:39200, ack 1, win 501, length 388
19:13:06.967307 IP 165.227.42.177.22 > 198.96.85.21.51536: Flags [P.], seq 39200:39468, ack 1, win 501, length 268
19:13:06.967360 IP 165.227.42.177.22 > 198.96.85.21.51536: Flags [P.], seq 39468:39856, ack 1, win 501, length 388
19:13:06.967402 IP 165.227.42.177.22 > 198.96.85.21.51536: Flags [P.], seq 39856:40124, ack 1, win 501, length 268
19:13:06.967452 IP 165.227.42.177.22 > 198.96.85.21.51536: Flags [P.], seq 40124:40512, ack 1, win 501, length 388
19:13:06.967493 IP 165.227.42.177.22 > 198.96.85.21.51536: Flags [P.], seq 40512:40780, ack 1, win 501, length 268
19:13:06.967545 IP 165.227.42.177.22 > 198.96.85.21.51536: Flags [P.], seq 40780:40936, ack 1, win 501, length 156
19:13:06.967651 IP 165.227.42.177.22 > 198.96.85.21.51536: Flags [P.], seq 40936:41436, ack 1, win 501, length 500
19:13:06.967752 IP 165.227.42.177.22 > 198.96.85.21.51536: Flags [P.], seq 41436:41704, ack 1, win 501, length 268
19:13:06.967905 IP 165.227.42.177.22 > 198.96.85.21.51536: Flags [P.], seq 41704:42436, ack 1, win 501, length 732
19:13:06.967937 IP 165.227.42.177.22 > 198.96.85.21.51536: Flags [P.], seq 42436:42472, ack 1, win 501, length 36
19:13:06.967995 IP 165.227.42.177.22 > 198.96.85.21.51536: Flags [P.], seq 42472:42740, ack 1, win 501, length 268
19:13:06.968069 IP 165.227.42.177.22 > 198.96.85.21.51536: Flags [P.], seq 42740:42896, ack 1, win 501, length 156
19:13:06.968112 IP 165.227.42.177.22 > 198.96.85.21.51536: Flags [P.], seq 42896:43052, ack 1, win 501, length 156
19:13:06.968155 IP 165.227.42.177.22 > 198.96.85.21.51536: Flags [P.], seq 43052:43208, ack 1, win 501, length 156
19:13:06.968213 IP 165.227.42.177.22 > 198.96.85.21.51536: Flags [P.], seq 43208:43476, ack 1, win 501, length 268
19:13:06.968273 IP 165.227.42.177.22 > 198.96.85.21.51536: Flags [P.], seq 43476:43728, ack 1, win 501, length 252
19:13:06.968332 IP 165.227.42.177.22 > 198.96.85.21.51536: Flags [P.], seq 43728:43964, ack 1, win 501, length 236
19:13:06.968369 IP 165.227.42.177.22 > 198.96.85.21.51536: Flags [P.], seq 43964:44000, ack 1, win 501, length 36
19:13:07.005042 IP 198.96.85.21.51536 > 165.227.42.177.22: Flags [.], ack 43476, win 2050, length 0
19:13:07.005260 IP 198.96.85.21.51536 > 165.227.42.177.22: Flags [.], ack 44000, win 2048, length 0
19:13:07.070693 IP 165.227.42.177.22 > 198.96.85.21.51536: Flags [P.], seq 44000:44148, ack 1, win 501, length 148
19:13:07.070781 IP 165.227.42.177.22 > 198.96.85.21.51536: Flags [P.], seq 44148:44304, ack 1, win 501, length 156
19:13:07.070853 IP 165.227.42.177.22 > 198.96.85.21.51536: Flags [P.], seq 44304:44572, ack 1, win 501, length 268
19:13:07.070928 IP 165.227.42.177.22 > 198.96.85.21.51536: Flags [P.], seq 44572:44728, ack 1, win 501, length 156
19:13:07.071000 IP 165.227.42.177.22 > 198.96.85.21.51536: Flags [P.], seq 44728:44996, ack 1, win 501, length 268
19:13:07.071067 IP 165.227.42.177.22 > 198.96.85.21.51536: Flags [P.], seq 44996:45376, ack 1, win 501, length 380
19:13:07.071123 IP 165.227.42.177.22 > 198.96.85.21.51536: Flags [P.], seq 45376:45764, ack 1, win 501, length 388
19:13:07.071176 IP 165.227.42.177.22 > 198.96.85.21.51536: Flags [P.], seq 45764:46152, ack 1, win 501, length 388
19:13:07.071219 IP 165.227.42.177.22 > 198.96.85.21.51536: Flags [P.], seq 46152:46420, ack 1, win 501, length 268
19:13:07.071261 IP 165.227.42.177.22 > 198.96.85.21.51536: Flags [P.], seq 46420:46688, ack 1, win 501, length 268
19:13:07.071309 IP 165.227.42.177.22 > 198.96.85.21.51536: Flags [P.], seq 46688:47068, ack 1, win 501, length 380
19:13:07.071350 IP 165.227.42.177.22 > 198.96.85.21.51536: Flags [P.], seq 47068:47336, ack 1, win 501, length 268
19:13:07.071391 IP 165.227.42.177.22 > 198.96.85.21.51536: Flags [P.], seq 47336:47604, ack 1, win 501, length 268
19:13:07.071431 IP 165.227.42.177.22 > 198.96.85.21.51536: Flags [P.], seq 47604:47872, ack 1, win 501, length 268
19:13:07.071471 IP 165.227.42.177.22 > 198.96.85.21.51536: Flags [P.], seq 47872:48140, ack 1, win 501, length 268
19:13:07.071513 IP 165.227.42.177.22 > 198.96.85.21.51536: Flags [P.], seq 48140:48392, ack 1, win 501, length 252
19:13:07.071551 IP 165.227.42.177.22 > 198.96.85.21.51536: Flags [P.], seq 48392:48532, ack 1, win 501, length 140
19:13:07.074229 IP 198.96.85.21.51536 > 165.227.42.177.22: Flags [.], ack 48532, win 2050, length 0

339 packets captured
350 packets received by filter
0 packets dropped by kernel
